{
	"name": "figma-integration",
	"area": "operate",
	"summary": "Keep Figma Variables and code tokens in sync in one direction, and check component parity across the boundary.",
	"trigger": {
		"when": [
			"Figma and code need to agree on tokens or components"
		],
		"not": [
			"auditing the token architecture itself"
		],
		"instead": {
			"the tiers or values are the problem": "design-tokens"
		}
	},
	"reads": [
		"skills/workflows/figma-integration.md",
		"skills/aven-brand/knowledge/integrations.md"
	],
	"gates": [
		"validate_tokens.py"
	],
	"steps": [
		"Pick ONE direction of truth and write it down. Two-way sync with no declared winner produces a system where neither side can be trusted.",
		"Map collections and modes to tiers and themes, not file-by-file.",
		"Check parity per component: same variants, same states, same names. A name that differs across the boundary is a translation everyone has to do forever."
	],
	"output": "The sync mapping, the direction of truth, and a parity table.",
	"done": [
		"the direction of truth is stated",
		"every mismatch is listed, not silently reconciled"
	],
	"supersedes": [
		"figma-variable-audit"
	]
}
